,category,city,name,rating,review,review_count,snippet_text,time_created,uid,urating
a-desi-cafe-san-francisco-3,Indian,San Francisco,A Desi Cafe,4.5,We came across this restaurant (a family of seven) by accident and were not the least bit disappointed.  Service was excellent (especially on a Saturday...,154.0,We came across this restaurant (a family of seven) by accident and were not the least bit disappointed.  Service was excellent (especially on a Saturday...,1486953450.0,ODHq5qmtdRX0o0QggdAj-g,5.0
the-dosa-brothers-san-francisco-4,Indian,San Francisco,The Dosa Brothers,4.5,"Made to order dosa! The guys working are super friendly to everyone - customers and everyone walking by the stand. 

I really appreciated the guy taking my...",175.0,"Super fain street vendor what has the loaded dosa's.

Location is subject to change depending on traffic patterns, weather, franchise number, permits,...",1490250671.0,bKqqC9HlY_8Ch9UoM5PnhA,5.0
august-1-five-san-francisco,Indian,San Francisco,August 1 Five,4.0,"Went again about 3 days ago, and loved everything. It was packed on a Saturday evening, around 5.45PM. This time we made reservations and so glad that we...",214.0,"Went again about 3 days ago, and loved everything. It was packed on a Saturday evening, around 5.45PM. This time we made reservations and so glad that we...",1489632140.0,26PPnXicEuoIgcvG-AoFog,5.0
viva-goa-san-francisco,Indian,San Francisco,Viva Goa,4.0,"Came here for dinner on a Friday night and there were plenty of tables available. 

All of the food was really good. I had the vegetable samosas, chicken...",343.0,"Came here for dinner on a Friday night and there were plenty of tables available. 

All of the food was really good. I had the vegetable samosas, chicken...",1487393374.0,49wpnk-zjBhwJP79T9IoXg,5.0
dum-indian-soul-food-san-francisco,Indian,San Francisco,DUM Indian Soul Food,4.0,"Fancy Indian food. We had three appetizers (pani poori, two vegetable parathas), one side of beans, and a plate of the fried tandoori chicken. The...",86.0,"Fancy Indian food. We had three appetizers (pani poori, two vegetable parathas), one side of beans, and a plate of the fried tandoori chicken. The...",1485839874.0,MB0quDwn_WbmTt_pAknfTg,5.0
kebab-king-san-francisco,Indian,San Francisco,Kebab King,4.5,"I barely write reviews and this is my first one on yelp but this place deserves a recognition!!
I am personally impressed with it. I have been to so many...",139.0,"I barely write reviews and this is my first one on yelp but this place deserves a recognition!!
I am personally impressed with it. I have been to so many...",1486189951.0,S2Dyt7SwUQEkFD4fXziMZg,5.0
red-chilli-san-francisco,Indian,San Francisco,Red Chilli,4.0,This place is off the shizzle pho nizzle. I just can't resist the taste and temptation of their chicken Tikka masala. When my taste buds make contact with...,290.0,This place is off the shizzle pho nizzle. I just can't resist the taste and temptation of their chicken Tikka masala. When my taste buds make contact with...,1489884195.0,eJLuQ8jwx3fP8_aS-gUbKA,5.0
campton-place-restaurant-san-francisco,Indian,San Francisco,Campton Place Restaurant,4.0,"The food was absolutely fantastic.  Each dish was beautiful, unique, and full of delicious Indian inspired flavors.  The most stand out dish was the lamb...",622.0,"The food was absolutely fantastic.  Each dish was beautiful, unique, and full of delicious Indian inspired flavors.  The most stand out dish was the lamb...",1488556294.0,kfhzp5XOktBWswkkas7fbw,5.0
om-indian-cuisine-san-francisco,Indian,San Francisco,Om Indian Cuisine,4.5,"Don't be fooled by all the poor Indian restaurants that have occupied this location...Om is in completely different class!

Their curries are not only super...",105.0,"Don't be fooled by all the poor Indian restaurants that have occupied this location...Om is in completely different class!

Their curries are not only super...",1489444356.0,tgDoCTmtO3TReVsHRrGrsQ,5.0
dakshin-san-francisco-6,Indian,San Francisco,Dakshin,4.0,"TLDR; Authentic, delicious south Indian food that is value for money, with good quality ingredients.

Dakshin is a really good add to the Polk street...",67.0,"TLDR; Authentic, delicious south Indian food that is value for money, with good quality ingredients.

Dakshin is a really good add to the Polk street...",1489096004.0,P683d939SXKANgNgZw_MJg,5.0
udupi-palace-san-francisco,Indian,San Francisco,Udupi Palace,4.0,"SO GOOD!

I came here with friends who were in town for a late dinner. I wanted to show them great southern Indian food without the DOSA price. We each...",1095.0,"SO GOOD!

I came here with friends who were in town for a late dinner. I wanted to show them great southern Indian food without the DOSA price. We each...",1490041072.0,Q5rLT0B67e4q3fg2DLYYDw,5.0
holy-kitchen-san-francisco,Indian,San Francisco,Holy Kitchen,4.0,"Omg I love this place. It's a gem not to miss if your taste buds are craving in for some authentic Indian cuisine.
You get that positive vibe the moment you...",179.0,"Omg I love this place. It's a gem not to miss if your taste buds are craving in for some authentic Indian cuisine.
You get that positive vibe the moment you...",1484934103.0,fFF4RPD9J7CCwo1EeIDPNw,5.0
aslams-rasoi-san-francisco,Indian,San Francisco,Aslam's Rasoi,4.0,"My favorite Indian place in SF. It's rarely packed to the brim, and the staff is very attentive. My go-to is the pakoras, garlic naan, and tandoori chicken,...",795.0,"My favorite Indian place in SF. It's rarely packed to the brim, and the staff is very attentive. My go-to is the pakoras, garlic naan, and tandoori chicken,...",1485144063.0,6k5xUjKC4AAxUeL78VLZpA,5.0
mela-tandoori-kitchen-san-francisco-2,Indian,San Francisco,Mela Tandoori Kitchen,4.0,"I don't think 5 stars does justice to the quality of food served here. I have eaten at loads of Pakistani restaurants.. Houston, virginia, dc, chicago, new...",377.0,"I don't think 5 stars does justice to the quality of food served here. I have eaten at loads of Pakistani restaurants.. Houston, virginia, dc, chicago, new...",1488948702.0,AhD-xoESoX0wy_pFIOsDWQ,5.0
chaat-corner-san-francisco-2,Indian,San Francisco,Chaat Corner,4.0,This restaurant has less seating but is extremely clean and the staff is very attentive. The food took time to come but what's great about this place is...,66.0,This restaurant has less seating but is extremely clean and the staff is very attentive. The food took time to come but what's great about this place is...,1486530186.0,qk2dIilo8wdMkzIZNgqbyw,5.0
newa-san-francisco-4,Indian,San Francisco,Newa,4.0,Came here on a Thursday night late with a friend! Love that this place stays open until past 10 pm - inside is cozy and there's a couple of large tables for...,81.0,Came here on a Thursday night late with a friend! Love that this place stays open until past 10 pm - inside is cozy and there's a couple of large tables for...,1488676497.0,RZ65B7v2b838WgrHa4goEw,4.0
saffron-grill-san-francisco,Indian,San Francisco,Saffron Grill,4.0,"My favorite Indian restaurant in the city. Delicious food, homey interior, and nice staff. I didn't ask but it feels like a family run place.

I've ordered...",407.0,"My favorite Indian restaurant in the city. Delicious food, homey interior, and nice staff. I didn't ask but it feels like a family run place.

I've ordered...",1483500441.0,Dxd6FZKyMQJvpBErJLn8nw,5.0
amber-india-san-francisco-2,Indian,San Francisco,Amber India,4.0,My boyfriend and I went to Amber India last week and had a wonderful night. This place has some of the best Indian food in the city! The menu was extensive...,1671.0,My boyfriend and I went to Amber India last week and had a wonderful night. This place has some of the best Indian food in the city! The menu was extensive...,1488840445.0,jmLy6uciFd1de0nGDe1hfw,5.0
dosa-on-fillmore-san-francisco-3,Indian,San Francisco,DOSA on Fillmore,4.0,"Love this place! 

Their Paneer one is the best :) The interior has a nice ambiance and great service.",2356.0,"Love this place! 

Their Paneer one is the best :) The interior has a nice ambiance and great service.",1490054487.0,6s2E1meM3-p4MEQwXZfjIw,5.0
dosa-on-valencia-san-francisco,Indian,San Francisco,DOSA on Valencia,4.0,"Oh maaannn, this has got to be one of the best food (and service) experiences I've had so far! After putting off an Indian food dinner date for a few weeks,...",2017.0,"Oh maaannn, this has got to be one of the best food (and service) experiences I've had so far! After putting off an Indian food dinner date for a few weeks,...",1489630160.0,6Pei9SKrB69e0N0wYlDaeA,5.0
pakwan-restaurant-16th-street-san-francisco,Indian,San Francisco,Pakwan Restaurant - 16th Street,4.0,"Whoa. Really flavorful food with great portions. I like it.

I suggest ordering take-out if you want to have a nice sit-down meal, otherwise you'll have to...",1475.0,"Why is this place so packed on a daily basis? Even the pick up line is crazy.

If you are looking for good portioned indian food, this would probably go on...",1490310638.0,kiwVPQ9jh2UIQn1sRes03A,5.0
lahore-karahi-san-francisco-2,Indian,San Francisco,Lahore Karahi,4.0,So this place is in the TL but it honestly didn't seem that bad..other than the really awkward situation of one of the servers getting into an argument with...,1226.0,So this place is in the TL but it honestly didn't seem that bad..other than the really awkward situation of one of the servers getting into an argument with...,1486658576.0,NkN0dp-nmrn1kWvIB0a7lw,5.0
little-delhi-san-francisco,Indian,San Francisco,Little Delhi,4.0,"Little Delhi is the best food option in Union Square. It's the perfect way to start and end a shopping day. 
The place is a decent size with a ton of staff...",1632.0,"Little Delhi is the best food option in Union Square. It's the perfect way to start and end a shopping day. 
The place is a decent size with a ton of staff...",1489723026.0,XEL38r_yzp-b-BQvN2nsAQ,4.0
north-india-restaurant-san-francisco,Indian,San Francisco,North India Restaurant,4.0,"Great service. 
Quick pick-up. 
Friendly staff. 
I had the chicken biryani with raita. 
It's the best biryani I've had in SF!",810.0,"Great service. 
Quick pick-up. 
Friendly staff. 
I had the chicken biryani with raita. 
It's the best biryani I've had in SF!",1489469538.0,Yad7ogkamRi2dnmFa4N_Yw,5.0
chennai-kings-san-francisco,Indian,San Francisco,Chennai Kings,3.5,"Good south Indian food! Their masala Dosa, pesto dosa, chicken dosa, sambhar, all chutneys - everything I've tried here has been amazing! I wish they...",75.0,"Good south Indian food! Their masala Dosa, pesto dosa, chicken dosa, sambhar, all chutneys - everything I've tried here has been amazing! I wish they...",1487391999.0,Crjg5XZnqFhAeDjH2RBnbg,4.0
spices-and-aroma-san-francisco,Indian,San Francisco,Spices and Aroma,5.0,"This was a very beautiful, delicious and well considered dining experience. The communal tables allow you to socialize while eating the most delicious food....",5.0,"This was a very beautiful, delicious and well considered dining experience. The communal tables allow you to socialize while eating the most delicious food....",1480967848.0,MIDhIlTbXM15RBYoMJKaig,5.0
panuchos-san-francisco,Mexican,San Francisco,Panucho's,4.5,"VERY impressed with their carnitas. I was hoping to find a burrito in the neighborhood that wasn't the normal, mediocre place I'd settle for on Columbus. I...",60.0,"VERY impressed with their carnitas. I was hoping to find a burrito in the neighborhood that wasn't the normal, mediocre place I'd settle for on Columbus. I...",1487900699.0,S4MB2dpIaBJwDAw2pxkqKA,5.0
garajito-san-francisco,Mexican,San Francisco,Garajito,4.5,"Hole in the wall and bring cash because it is cash only! 

Their Ahi Taco is simply the must order!  Variety of hot sauces with their tacos, is enlightening...",38.0,"Hole in the wall and bring cash because it is cash only! 

Their Ahi Taco is simply the must order!  Variety of hot sauces with their tacos, is enlightening...",1487873379.0,I-FmdvI28N7OIIt4JZOgIg,5.0
el-buen-comer-san-francisco-3,Mexican,San Francisco,El Buen Comer,4.5,"If you want to try REAL AUTHENTIC MEXICAN FOOD 
THIS IS THE PLACE!!! 

Service is great , the environment is awesome and it's delicious. 
As a Mexican it...",108.0,"If you want to try REAL AUTHENTIC MEXICAN FOOD 
THIS IS THE PLACE!!! 

Service is great , the environment is awesome and it's delicious. 
As a Mexican it...",1488767532.0,dbI7OyfXInaBaCi30LcKBQ,5.0
la-palma-mexicatessen-san-francisco,Mexican,San Francisco,La Palma Mexicatessen,4.5,"Super delicious food in the mission! HELL YEAH!

I recently had a falling out with El Farolito and La Guadalajara, feeling like they weren't as good as they...",507.0,"Super delicious food in the mission! HELL YEAH!

I recently had a falling out with El Farolito and La Guadalajara, feeling like they weren't as good as they...",1489256522.0,UlTZHFIuY0OXUTS3jP_63g,5.0
primavera-san-francisco,Mexican,San Francisco,Primavera,4.5,"Favorite Saturday morning activity in SF: eating chilaqueles with extra tasty primavera salsa at the ferry building farmers market.

Do yourself a favor and...",197.0,"Favorite Saturday morning activity in SF: eating chilaqueles with extra tasty primavera salsa at the ferry building farmers market.

Do yourself a favor and...",1461779440.0,tZ6UTquj55ULeqKjckOsug,5.0
mexico-tipico-san-francisco-2,Mexican,San Francisco,Mexico Tipico,4.5,"I love this place
My FAVORitE taqueria
I love the veggie burrito
It is the tastiest and best place period!",153.0,"I love this place
My FAVORitE taqueria
I love the veggie burrito
It is the tastiest and best place period!",1489976842.0,xAU3QNRUBiSXCWbpq7XnDA,5.0
garaje-san-francisco,Mexican,San Francisco,Garaje,4.5,"You walk into an inconspicuous area then through a black door to very loud song compromised of kitchen noises, laughter, glass clinking, and a very well...",1113.0,"You walk into an inconspicuous area then through a black door to very loud song compromised of kitchen noises, laughter, glass clinking, and a very well...",1486156500.0,c1rNOHcOQnTGJLjh67Rjfg,5.0
don-pistos-tequila-bar-san-francisco,Mexican,San Francisco,Don Pistos Tequila Bar,4.0,"Wow! What an amazing addition to the Marina! They offer a great selection of drinks and food! The sashimi, fish tacos, and veggie burrito were AMAZING! Did...",56.0,"Wow! What an amazing addition to the Marina! They offer a great selection of drinks and food! The sashimi, fish tacos, and veggie burrito were AMAZING! Did...",1487013143.0,_m0ShLR5zXnMxTWFvU_vPw,5.0
don-pistos-san-francisco-2,Mexican,San Francisco,Don Pisto's,4.0,We had brunch reservations somewhere else and decided tacos and bottomless drinks were more our flavor. A Google search led us to Don Pistos and we walked...,1523.0,We had brunch reservations somewhere else and decided tacos and bottomless drinks were more our flavor. A Google search led us to Don Pistos and we walked...,1490035377.0,YzwYH3w5nXBiQo6xIoCBxA,5.0
the-castro-republic-san-francisco,Mexican,San Francisco,The Castro Republic,4.5,"I see where other reviewers are coming from with the price point but whatever, this place is so good! We stumbled upon this place randomly last weekend and...",159.0,"I see where other reviewers are coming from with the price point but whatever, this place is so good! We stumbled upon this place randomly last weekend and...",1478910125.0,RBXbxdZyoKDTyw4PCMHKLg,5.0
mateos-taqueria-san-francisco,Mexican,San Francisco,Mateo's Taqueria,4.5,"Hot damn is this place good. I just had Mateo's tacos yesterday and I'm pissed I don't have them for lunch today. 

Personal favorites include: chorizo taco...",240.0,"Hot damn is this place good. I just had Mateo's tacos yesterday and I'm pissed I don't have them for lunch today. 

Personal favorites include: chorizo taco...",1488828051.0,AIckPsUumilTwl2089x4rg,5.0
el-farolito-san-francisco-2,Mexican,San Francisco,El Farolito,4.0,"*cash only*

Big fan of El Farolito. Have only ever had burritos, and can't go wrong! Be ready for a line late at night.",3999.0,"I was visiting SF from Texas, so I'm always looking for the next authentic Mexican meal. During my stay, I've come back to El Farolito multiple times...",1490315093.0,hyQWZtx_befbiIGzpPXb-A,5.0
street-taco-san-francisco,Mexican,San Francisco,Street Taco,4.0,"As a vegetarian, I'm a veggie burrito connoisseur. I've made it my duty to scour the land in search of the best vegetarian burrito. At the moment, it...",387.0,"As a vegetarian, I'm a veggie burrito connoisseur. I've made it my duty to scour the land in search of the best vegetarian burrito. At the moment, it...",1487728492.0,ud-fWq-05TVr2KwONoMTtQ,5.0
taqueria-el-farolito-san-francisco,Mexican,San Francisco,Taqueria El Farolito,4.0,"Wow. I did not expect this place to be as good as it was, but I was blown away. After walking through Fishermans Wharf and seeing all of the tourist...",41.0,"Wow. I did not expect this place to be as good as it was, but I was blown away. After walking through Fishermans Wharf and seeing all of the tourist...",1488720707.0,ZPN98PI53a9P7ZWM8V0qnw,5.0
la-taqueria-san-francisco-2,Mexican,San Francisco,La Taqueria,4.0,"A neighborhood favorite. Go with a dorado-style burrito. That's all you need to know!

Watch for early close-times!",2825.0,"By far my favorite spot in SF for good authentic mexican food. La Taqueria is amazing!

I usually get a chorizo super burrito extra crispy. Their...",1490315390.0,hyQWZtx_befbiIGzpPXb-A,5.0
taqueria-guadalajara-san-francisco,Mexican,San Francisco,Taqueria Guadalajara,4.0,Yooooooo. How could I have not written a review for this spot? I grew up in this neighborhood and frequented this specific taqueria for YEARS! I even...,713.0,Yooooooo. How could I have not written a review for this spot? I grew up in this neighborhood and frequented this specific taqueria for YEARS! I even...,1489339203.0,xjpxV48MJ29IdwlVz1kWsA,5.0
el-farolito-san-francisco,Mexican,San Francisco,El Farolito,4.0,"Dang Gina....where have u been hiding, u saucy little minx?! I have hated on Farolito for so long cuz they have what I call ""fake chips"" but I came here...",548.0,"Dang Gina....where have u been hiding, u saucy little minx?! I have hated on Farolito for so long cuz they have what I call ""fake chips"" but I came here...",1488425743.0,JPjiiUSyHL8Mhtap-chOQw,5.0
flores-san-francisco,Mexican,San Francisco,Flores,4.0,"My boyfriend and I found this place on Yelp while on vacation in San Fran. We went in a bit before 7pm on a Monday night and it was relatively busy, but we...",73.0,"My boyfriend and I found this place on Yelp while on vacation in San Fran. We went in a bit before 7pm on a Monday night and it was relatively busy, but we...",1490138655.0,4RaBtn5YdpcbejQLBvyy4Q,5.0
el-metate-restaurant-san-francisco,Mexican,San Francisco,El Metate Restaurant,4.0,"So I first learned of El Metate a few years back in an episode of KQED's Check Please Bay Area. I was impressed by the episode, and by the diners' reviews...",982.0,"So I first learned of El Metate a few years back in an episode of KQED's Check Please Bay Area. I was impressed by the episode, and by the diners' reviews...",1489696174.0,INEuEzk2wBI1W8MXHUD73Q,5.0
nopalito-san-francisco-3,Mexican,San Francisco,Nopalito,4.0,"I appreciated the fun, open atmosphere (with tables inside and outside of the restaurant). The big windows made the window seats a nice spot for...",853.0,"I appreciated the fun, open atmosphere (with tables inside and outside of the restaurant). The big windows made the window seats a nice spot for...",1490233954.0,e21BoUSY3MaR4u3FFRXZjw,5.0
el-castillito-san-francisco-2,Mexican,San Francisco,El Castillito,4.0,A great place to eat. I had a flavorful taco salad with bbq chicken and refried beans. Fast friendly service. Yes try this place. Authentic Mexican food. Yummy.,739.0,A great place to eat. I had a flavorful taco salad with bbq chicken and refried beans. Fast friendly service. Yes try this place. Authentic Mexican food. Yummy.,1489954339.0,s47c8hD7gfTqreYmSt-aFg,5.0
the-little-chihuahua-san-francisco,Mexican,San Francisco,The Little Chihuahua,4.0,This place is my go to burrito spot. In a city that caters to meat eating burrito lovers The Little Chihuahua is a haven. Try the fried plantain burrito....,1303.0,This place is my go to burrito spot. In a city that caters to meat eating burrito lovers The Little Chihuahua is a haven. Try the fried plantain burrito....,1486532071.0,3eSL4FYFJMbjQhXlypVrXg,5.0
toma-san-francisco,Mexican,San Francisco,Toma,4.0,"I've been here several times during my lunch breaks. The cashiers are super friendly, and the food is made fairly quickly and is really delicious. I usually...",226.0,"I've been here several times during my lunch breaks. The cashiers are super friendly, and the food is made fairly quickly and is really delicious. I usually...",1484518664.0,SnXO2gaLNig2_RXHVlxwMw,5.0
taqueria-dos-charros-san-francisco-2,Mexican,San Francisco,Taqueria Dos Charros,4.0,California burrito is the way to go. Deciding factor for me was the fact that the California burrito has waffle fries in it. My choice of meat was carne...,113.0,California burrito is the way to go. Deciding factor for me was the fact that the California burrito has waffle fries in it. My choice of meat was carne...,1477031127.0,0bw-AaTJX1wiZ5zIjk3WGA,5.0
mezcalito-san-francisco,Mexican,San Francisco,Mezcalito,4.0,eXperience all nite was A+ with our Barkeep ALEX mixing drinks and catering to us in Awesome fashion. Unfortunately some drunk 'locals' showed up (even...,84.0,eXperience all nite was A+ with our Barkeep ALEX mixing drinks and catering to us in Awesome fashion. Unfortunately some drunk 'locals' showed up (even...,1489822254.0,qUPgcVR_WRJ8HhViLPyIWw,4.0
revelry-bistro-san-francisco,American (New),San Francisco,Revelry Bistro,4.5,"Wife surprised me and took me here for a birthday dinner. We were both surprised to see Jerome, who used to work at Central Parc, behind the bar. Apparently...",73.0,"Wife surprised me and took me here for a birthday dinner. We were both surprised to see Jerome, who used to work at Central Parc, behind the bar. Apparently...",1486966103.0,t3lxen7wGR-4w-tGVGCVWQ,5.0
petes-san-francisco-4,American (New),San Francisco,Pete's,4.5,Petes is a great bar to go to based on staff/service and food. I'm surprised this place isn't packed on weekends whenever I pass by. It's a hidden gem...,67.0,Petes is a great bar to go to based on staff/service and food. I'm surprised this place isn't packed on weekends whenever I pass by. It's a hidden gem...,1485072624.0,nkH2ZNsj_irkmwyeY8famA,5.0
liholiho-yacht-club-san-francisco-2,American (New),San Francisco,Liholiho Yacht Club,4.5,"I've been waiting to try this place for a while. Totally worth the wait. Reservations are kinda tight for two but if you don't mind having dinner early,...",1188.0,"Arrived 15 minutes early on Thursday, 3/9/17, for a 7:30 reservation and was seated within 5 minutes. This time, the hostess brought us to a back dining...",1490330081.0,pD6LrIOvKrMPjPy9Y0tGyw,5.0
hoffmanns-grill-and-rotisserie-san-francisco,American (New),San Francisco,Hoffmann's Grill & Rotisserie,4.5,"Omg, what took me so long to check out Hoffmans?
We live maybe 5 blocks away from it and had been wanting to check it out for years. We finally did on New...",143.0,"Omg, what took me so long to check out Hoffmans?
We live maybe 5 blocks away from it and had been wanting to check it out for years. We finally did on New...",1484804112.0,7_bduZndHbB7i6i57bkFFQ,5.0
stones-throw-san-francisco-2,American (New),San Francisco,Stones Throw,4.5,"I've come to Stones Throw about 3-4 times now in the past year - and have loved every. single. time. The food is first of all amazingggggg - two brunches,...",702.0,"I've come to Stones Throw about 3-4 times now in the past year - and have loved every. single. time. The food is first of all amazingggggg - two brunches,...",1489470460.0,FnakyxEs4HAEi0r4SrIQ1Q,5.0
3rd-cousin-san-francisco-2,American (New),San Francisco,3rd Cousin,4.5,"Great food, experimentative but not outlandish menu. Chef very bold with using a variety of ingredients, worked very well. 

Recommend: tasting menu as it...",87.0,"Great food, experimentative but not outlandish menu. Chef very bold with using a variety of ingredients, worked very well. 

Recommend: tasting menu as it...",1487644371.0,-UIF6v07jaLPBLvlowCVdQ,5.0
trestle-san-francisco,American (New),San Francisco,Trestle,4.5,"You'd be surprised how often I receive texts from friends that read like ""YO I need to plan a date for this weekend that seems really nice but is actually...",456.0,"3 Course Prix Fixe Meal for only $35?? Sign me up!

AMBIENCE: We came for dinner time and the house was full. It had a small, clean, and intimate setting....",1490295882.0,5gZPpRGt_5qFrVc6fR2m5Q,5.0
the-vista-room-san-francisco,American (New),San Francisco,The Vista Room,4.5,"What a great opportunity to support the emerging hospitality community at SF state. 

Enjoy a 3 course meal including beverage for a flat $17.  Plenty of...",44.0,"What a great opportunity to support the emerging hospitality community at SF state. 

Enjoy a 3 course meal including beverage for a flat $17.  Plenty of...",1455680670.0,ZGsFzBbCEyIB0BmFGVILtw,5.0
20-spot-san-francisco,American (New),San Francisco,20 Spot,4.5,"This place is an absolute GEM from the adorable corner space itself to the staff, food, wine and lastly, the music. The vibe feels so great in this place...",181.0,"This place is an absolute GEM from the adorable corner space itself to the staff, food, wine and lastly, the music. The vibe feels so great in this place...",1488825749.0,fI8_wG48Z_BSev1qOWhUYA,5.0
